{
  "triggers": [],
  "trigger_count": 0,
  "dropped": {
    "undated": 0,
    "out_of_window": 0,
    "generic": 0,
    "other_entity": 0
  },
  "item_result": {
    "item": null,
    "item_key": "",
    "item_label": "",
    "status": "skipped",
    "headline": "Empty slot.",
    "source_ids": []
  },
  "report": {
    "title": "Empty slot",
    "summary": "",
    "severity": "info",
    "sections": [],
    "sources": [],
    "unknowns": [],
    "meta": {
      "skill": "account-trigger-events",
      "skill_version": "1.1.0",
      "generated_at": "2026-10-12T09:00:00Z"
    }
  }
}
